{
  "schema_version": "goal-teams-release-engine-profile-v1",
  "protocol_version": "V2.40",
  "version": "V2.40",
  "status": "historical_replay",
  "external_writes_allowed": false,
  "published_before": null,
  "tag": "v2.40",
  "candidate_location": "develops/v2.40",
  "candidate_branch": "codex/v2.40",
  "goal_teams_work": "GoalTeamsWork-V2.40",
  "goal_teams_work_location": "candidate",
  "owner_run_id": "RUN-V240-LEAD",
  "profile_path": "references/profiles/goal-teams-self-release-v2.40.md",
  "release_title": "Goal Teams V2.40",
  "release_body": "Goal Teams V2.40. See release/current/README.md in the tagged source.",
  "tag_message": "Goal Teams V2.40",
  "workflow_display_prefix": "Goal Teams V2.40 release ",
  "legacy_recovery_required": true,
  "snapshot_schema_version": "goal-teams-release-snapshot-v2.40",
  "files_manifest_format": "sha256-mode-size-path-v1",
  "public_scan_baseline": "references/public-release-scan-baseline-v2.40.json",
  "close_schema_version": "goal-teams-release-close-v2.40",
  "host_acceptance": null
}
